text,subcategory
como cancelar actividades secundarias y mantener la principal?,0060
que autoridad firma la resolucion de cierre?,0060
se genera certificado de cierre de actividad economica?,0060
puedo cerrar la actividad si mi licencia esta suspendida?,0060
como anulo la placa municipal al cerrar?,0060
el cierre se refleja inmediatamente en la base de datos municipal?,0060
cierre de actividad de importacion requiere tramite adicional?,0060
como cierro un negocio que ya no opera hace anos?,0060
se necesita inspeccion de salubridad para cierre de restaurante?,0060
cierre de actividad afecta el ruat de vehiculos de la empresa?,0060
como dar de baja varias sucursales al mismo tiempo?,0060
se devuelve la garantia bancaria al cerrar la actividad?,0060
puedo cerrar solo la matriz y mantener las sucursales?,0060
que sucede si reabro sin haber cancelado la baja?,0060
donde puedo consultar el estado de mi tramite de cierre?,0060
